{
  "kind": "pure-fn/v1",
  "offsets": "utf16",
  "provenance": {
    "source": "new (docs/plan/04 § Fixtures): ZWJ, keycaps, skin tones, NFC/NFD, CJK, CRLF, 4-byte UTF-8, regional indicators, Hangul, Indic conjunct, tag flag, prepend, IVS and the r7-opencode E2 string; outputs from Intl.Segmenter (ICU 78, Unicode 17) and UTF-8 byte counts; index i is UTF-16 offset i, null inside a character",
    "license": "Apache-2.0 OR MIT",
    "author": "murmo"
  },
  "fn": "text.offsets",
  "cases": [
    {
      "id": "zwj-family",
      "input": {
        "text": "👨\u200d👩\u200d👧\u200d👦x"
      },
      "output": {
        "codePoint": [0, null, 1, 2, null, 3, 4, null, 5, 6, null, 7, 8],
        "utf8": [0, null, 4, 7, null, 11, 14, null, 18, 21, null, 25, 26],
        "grapheme": [0, null, null, null, null, null, null, null, null, null, null, 1, 2]
      }
    },
    {
      "id": "keycaps",
      "input": {
        "text": "1\ufe0f\u20e3#\ufe0f\u20e3"
      },
      "output": {
        "codePoint": [0, 1, 2, 3, 4, 5, 6],
        "utf8": [0, 1, 4, 7, 8, 11, 14],
        "grapheme": [0, null, null, 1, null, null, 2]
      }
    },
    {
      "id": "skin-tones",
      "input": {
        "text": "👋🏿👋"
      },
      "output": {
        "codePoint": [0, null, 1, null, 2, null, 3],
        "utf8": [0, null, 4, null, 8, null, 12],
        "grapheme": [0, null, null, null, 1, null, 2]
      }
    },
    {
      "id": "nfc-e",
      "input": {
        "text": "café"
      },
      "output": {
        "codePoint": [0, 1, 2, 3, 4],
        "utf8": [0, 1, 2, 3, 5],
        "grapheme": [0, 1, 2, 3, 4]
      }
    },
    {
      "id": "nfd-e",
      "input": {
        "text": "cafe\u0301"
      },
      "output": {
        "codePoint": [0, 1, 2, 3, 4, 5],
        "utf8": [0, 1, 2, 3, 4, 6],
        "grapheme": [0, 1, 2, 3, null, 4]
      }
    },
    {
      "id": "combining-stack",
      "input": {
        "text": "a\u0301\u0302\u0303b"
      },
      "output": {
        "codePoint": [0, 1, 2, 3, 4, 5],
        "utf8": [0, 1, 3, 5, 7, 8],
        "grapheme": [0, null, null, null, 1, 2]
      }
    },
    {
      "id": "cjk-mixed",
      "input": {
        "text": "a中文b字"
      },
      "output": {
        "codePoint": [0, 1, 2, 3, 4, 5],
        "utf8": [0, 1, 4, 7, 8, 11],
        "grapheme": [0, 1, 2, 3, 4, 5]
      }
    },
    {
      "id": "crlf-end",
      "input": {
        "text": "teh\r\n"
      },
      "output": {
        "codePoint": [0, 1, 2, 3, 4, 5],
        "utf8": [0, 1, 2, 3, 4, 5],
        "grapheme": [0, 1, 2, 3, null, 4]
      }
    },
    {
      "id": "lone-cr-lf",
      "input": {
        "text": "\r\r\n\n"
      },
      "output": {
        "codePoint": [0, 1, 2, 3, 4],
        "utf8": [0, 1, 2, 3, 4],
        "grapheme": [0, 1, null, 2, 3]
      }
    },
    {
      "id": "four-byte",
      "input": {
        "text": "𝄞𠀀x"
      },
      "output": {
        "codePoint": [0, null, 1, null, 2, 3],
        "utf8": [0, null, 4, null, 8, 9],
        "grapheme": [0, null, 1, null, 2, 3]
      }
    },
    {
      "id": "regional-indicators-odd",
      "input": {
        "text": "🇺🇦🇺"
      },
      "output": {
        "codePoint": [0, null, 1, null, 2, null, 3],
        "utf8": [0, null, 4, null, 8, null, 12],
        "grapheme": [0, null, null, null, 1, null, 2]
      }
    },
    {
      "id": "hangul-jamo",
      "input": {
        "text": "각한"
      },
      "output": {
        "codePoint": [0, 1, 2, 3, 4],
        "utf8": [0, 3, 6, 9, 12],
        "grapheme": [0, null, null, 1, 2]
      }
    },
    {
      "id": "devanagari-conjunct",
      "input": {
        "text": "क\u094dष\u093f"
      },
      "output": {
        "codePoint": [0, 1, 2, 3, 4],
        "utf8": [0, 3, 6, 9, 12],
        "grapheme": [0, null, null, null, 1]
      }
    },
    {
      "id": "england-flag",
      "input": {
        "text": "🏴\udb40\udc67\udb40\udc62\udb40\udc65\udb40\udc6e\udb40\udc67\udb40\udc7f!"
      },
      "output": {
        "codePoint": [0, null, 1, null, 2, null, 3, null, 4, null, 5, null, 6, null, 7, 8],
        "utf8": [0, null, 4, null, 8, null, 12, null, 16, null, 20, null, 24, null, 28, 29],
        "grapheme": [0, null, null, null, null, null, null, null, null, null, null, null, null, null, 1, 2]
      }
    },
    {
      "id": "arabic-prepend",
      "input": {
        "text": "\u0600١٢"
      },
      "output": {
        "codePoint": [0, 1, 2, 3],
        "utf8": [0, 2, 4, 6],
        "grapheme": [0, null, 1, 2]
      }
    },
    {
      "id": "ideographic-variation",
      "input": {
        "text": "葛\udb40\udd00x"
      },
      "output": {
        "codePoint": [0, 1, null, 2, 3],
        "utf8": [0, 3, null, 7, 8],
        "grapheme": [0, null, null, 1, 2]
      }
    },
    {
      "id": "opencode-e2",
      "note": "r7-opencode: 19 code points, 26 UTF-16 units, 51 UTF-8 bytes, 11 graphemes",
      "input": {
        "text": "😀 👨\u200d👩\u200d👧\u200d👦 🇺🇦 e\u0301 中文 "
      },
      "output": {
        "codePoint": [
          0,
          null,
          1,
          2,
          null,
          3,
          4,
          null,
          5,
          6,
          null,
          7,
          8,
          null,
          9,
          10,
          null,
          11,
          null,
          12,
          13,
          14,
          15,
          16,
          17,
          18,
          19
        ],
        "utf8": [
          0,
          null,
          4,
          5,
          null,
          9,
          12,
          null,
          16,
          19,
          null,
          23,
          26,
          null,
          30,
          31,
          null,
          35,
          null,
          39,
          40,
          41,
          43,
          44,
          47,
          50,
          51
        ],
        "grapheme": [
          0,
          null,
          1,
          2,
          null,
          null,
          null,
          null,
          null,
          null,
          null,
          null,
          null,
          null,
          3,
          4,
          null,
          null,
          null,
          5,
          6,
          null,
          7,
          8,
          9,
          10,
          11
        ]
      }
    }
  ]
}
