{
  "kind": "pure-fn/v1",
  "offsets": "utf16",
  "provenance": {
    "source": "new (docs/plan/04 § Offsets): every cursor of two drafts as [codePoint, utf8, grapheme, graphemeBefore, graphemeAfter], null where refused; graphemeBefore is the Backspace target; outputs from Intl.Segmenter",
    "license": "Apache-2.0 OR MIT",
    "author": "murmo"
  },
  "fn": "text.boundaries",
  "cases": [
    {
      "id": "accent-crlf-emoji",
      "input": {
        "text": "e\u0301x\r\n😀",
        "cursors": [0, 1, 2, 3, 4, 5, 6, 7]
      },
      "output": [
        [0, 0, 0, null, 2],
        [1, 1, null, null, null],
        [2, 3, 1, 0, 3],
        [3, 4, 2, 2, 5],
        [4, 5, null, null, null],
        [5, 6, 3, 3, 7],
        [null, null, null, null, null],
        [6, 10, 4, 5, null]
      ]
    },
    {
      "id": "flag-zwj",
      "input": {
        "text": "🇺🇦👩\u200d💻.",
        "cursors": [0, 1, 2, 3, 4, 5, 6, 7, 8, 9, 10]
      },
      "output": [
        [0, 0, 0, null, 4],
        [null, null, null, null, null],
        [1, 4, null, null, null],
        [null, null, null, null, null],
        [2, 8, 1, 0, 9],
        [null, null, null, null, null],
        [3, 12, null, null, null],
        [4, 15, null, null, null],
        [null, null, null, null, null],
        [5, 19, 2, 4, 10],
        [6, 20, 3, 9, null]
      ]
    }
  ]
}
